{
  "manifest_version": 1,
  "project": {
    "name": "RAG Dashboard",
    "repository": "CHINGBOH/RAG26",
    "path": ".",
    "purpose": "Machine-readable index of reusable repo surfaces and capabilities for humans, AI agents, and tooling.",
    "monorepo": true,
    "stacks": [
      "Python",
      "TypeScript",
      "Go",
      "React",
      "FastAPI",
      "Fastify",
      "Gin",
      "Vite"
    ],
    "last_updated": "2026-05-06"
  },
  "status_legend": {
    "canonical": "Preferred active surface for new work or discovery.",
    "legacy": "Still present or active, but not the preferred surface when a newer canonical path exists.",
    "internal-only": "Useful for maintainers or tooling, but not intended as a primary external surface.",
    "supporting": "Important supporting surface such as docs, scripts, templates, or optional infrastructure."
  },
  "maintenance": {
    "update_when": [
      "A major service, shared package, config entrypoint, important script, or key doc is added, removed, renamed, or cut over.",
      "Routing ownership changes between Vite proxy, Go gateway, Node orchestrator, Python legacy, retrieval-service, or Go WebSocket.",
      "A surface changes lifecycle status between canonical, legacy, internal-only, or supporting."
    ],
    "authoring_rules": [
      "Keep all paths repo-relative.",
      "Prefer updating an existing resource entry over adding aliases for the same responsibility.",
      "If an older surface remains runtime-active but is no longer preferred, mark it legacy instead of canonical.",
      "Keep executable config ownership attached to real code paths such as config loaders, proxy maps, and compose files.",
      "Populate notable_exports for key reusable code surfaces so humans and AI can find callable entrypoints without grepping blindly.",
      "Run npm run check:resource-index after editing this manifest, docs/project-resource-index.md, or the README reuse-first entry section."
    ]
  },
  "topology": {
    "routing_entrypoints": [
      "src/frontend/web/vite.config.ts",
      "src/backend/go-services/config/runtime.go",
      "src/backend/go-services/internal/gateway/proxy.go"
    ],
    "notes": [
      "Current dev routing split: /api/agent goes directly to Node on 3001, /api/v1 goes directly to retrieval-service on 8002, /api plus /health plus /metrics go to the Go gateway on 8080, and /ws goes to the Go WebSocket gateway on 8081.",
      "Canonical search routing is Go gateway -> retrieval-service for /api/search; Python legacy is not the canonical search backend."
    ],
    "connections": [
      {
        "from": "frontend-web",
        "to": "node-orchestrator",
        "via": "vite-dev-proxy",
        "paths": [
          "/api/agent"
        ],
        "note": "Direct in dev until the gateway fully owns that prefix."
      },
      {
        "from": "frontend-web",
        "to": "retrieval-service",
        "via": "vite-dev-proxy",
        "paths": [
          "/api/v1"
        ],
        "note": "Direct in dev per current Vite config."
      },
      {
        "from": "frontend-web",
        "to": "go-api-gateway",
        "via": "vite-dev-proxy",
        "paths": [
          "/api",
          "/health",
          "/metrics"
        ]
      },
      {
        "from": "frontend-web",
        "to": "go-websocket-gateway",
        "via": "vite-dev-proxy",
        "paths": [
          "/ws"
        ]
      },
      {
        "from": "go-api-gateway",
        "to": "node-orchestrator",
        "via": "prefix-route-map",
        "paths": [
          "/api/sessions",
          "/api/activity",
          "/api/heartbeat",
          "/api/auth",
          "/api/llm/chat",
          "/api/cache",
          "/api/queue",
          "/api/system",
          "/api/pipeline",
          "/api/agent"
        ]
      },
      {
        "from": "go-api-gateway",
        "to": "python-legacy-api",
        "via": "prefix-route-map",
        "paths": [
          "/api/v1/embedding",
          "/api/v1/documents",
          "/api/stats",
          "/api/v1/stats"
        ]
      },
      {
        "from": "go-api-gateway",
        "to": "retrieval-service",
        "via": "prefix-route-map",
        "paths": [
          "/api/search",
          "/api/retrieval",
          "/api/v1/search",
          "/api/v1/rerank",
          "/api/v1/rag",
          "/api/v1/agent",
          "/api/v1/system-kb",
          "/api/v1/architecture",
          "/api/v1/collections"
        ]
      },
      {
        "from": "go-api-gateway",
        "to": "ocr-service",
        "via": "prefix-route-map",
        "paths": [
          "/api/ocr"
        ]
      },
      {
        "from": "node-orchestrator",
        "to": "go-websocket-gateway",
        "via": "broadcast-client",
        "paths": [
          "/broadcast"
        ],
        "note": "WebSocketManager and related services push realtime updates through the Go WS gateway."
      }
    ]
  },
  "resources": [
    {
      "id": "go-api-gateway",
      "kind": "service",
      "name": "Go API Gateway",
      "path": "src/backend/go-services",
      "languages": [
        "Go"
      ],
      "stack": [
        "Gin",
        "net/http reverse proxy",
        "OpenTelemetry"
      ],
      "purpose": "Canonical HTTP ingress and reverse proxy across backend services.",
      "status": "canonical",
      "ports": [
        8080
      ],
      "entrypoints": [
        "src/backend/go-services/cmd/gateway/main.go",
        "src/backend/go-services/config/runtime.go",
        "src/backend/go-services/config/default.json",
        "src/backend/go-services/internal/gateway/proxy.go"
      ],
      "notable_exports": [
        "LoadConfig",
        "SetupRouter",
        "getRouteMapping",
        "findTargetService",
        "ProxyHandler"
      ],
      "capabilities": [
        "http-ingress",
        "route-mapping",
        "aggregated-health",
        "prometheus-metrics",
        "request-tracing"
      ],
      "key_commands": [
        "cd src/backend/go-services && go build -o gateway ./cmd/gateway/main.go",
        "cd src/backend/go-services && ./gateway --port 8080"
      ],
      "usage_cues": [
        "Add new frontend-visible API prefixes to internal/gateway/proxy.go:getRouteMapping().",
        "Gateway runtime values now flow through src/backend/go-services/config/runtime.go with precedence embedded defaults -> optional JSON config file -> env -> CLI."
      ],
      "tags": [
        "backend",
        "gateway",
        "routing",
        "proxy"
      ]
    },
    {
      "id": "go-websocket-gateway",
      "kind": "service",
      "name": "Go WebSocket Gateway",
      "path": "src/backend/go-services",
      "languages": [
        "Go"
      ],
      "stack": [
        "Go",
        "WebSocket hub"
      ],
      "purpose": "Canonical realtime fan-out gateway for browser websocket clients.",
      "status": "canonical",
      "ports": [
        8081
      ],
      "entrypoints": [
        "src/backend/go-services/cmd/websocket/main.go",
        "src/backend/go-services/config/runtime.go",
        "src/backend/go-services/config/default.json",
        "src/backend/go-services/internal/websocket/server.go",
        "src/backend/go-services/internal/websocket/hub.go"
      ],
      "capabilities": [
        "websocket-hub",
        "broadcast-fanout",
        "realtime-status-streams"
      ],
      "key_commands": [
        "cd src/backend/go-services && go build -o websocket ./cmd/websocket/main.go",
        "cd src/backend/go-services && ./websocket --port 8081"
      ],
      "usage_cues": [
        "Frontend /ws traffic is proxied here in dev.",
        "Node-side broadcast clients send updates to this gateway rather than speaking websocket directly to the browser.",
        "WebSocket port, upgrader buffer sizes, and origin policy are centralized in src/backend/go-services/config/runtime.go."
      ],
      "tags": [
        "backend",
        "websocket",
        "realtime"
      ]
    },
    {
      "id": "node-orchestrator",
      "kind": "service",
      "name": "Node Orchestrator",
      "path": "src/backend/server",
      "languages": [
        "TypeScript"
      ],
      "stack": [
        "Fastify",
        "XState v5",
        "Vitest"
      ],
      "purpose": "Fastify/XState runtime for sessions, agent orchestration, auth, and pipeline coordination.",
      "status": "canonical",
      "ports": [
        3001
      ],
      "entrypoints": [
        "src/backend/server/src/index.ts",
        "src/backend/server/package.json"
      ],
      "notable_exports": [
        "AgentFactory.create",
        "ReactAgent.run",
        "createFourDatabaseTools",
        "createVectorSearchTool"
      ],
      "capabilities": [
        "session-runtime",
        "xstate-orchestration",
        "agent-api",
        "auth",
        "pipeline-control",
        "websocket-broadcast-client"
      ],
      "key_commands": [
        "cd src/backend/server && npx tsx src/index.ts",
        "cd src/backend/server && npm run build",
        "cd src/backend/server && npm test"
      ],
      "usage_cues": [
        "Startup/runtime defaults now live in src/backend/server/config/default.json and are resolved through src/backend/server/src/config/runtime.ts using config + dotenv + commander.",
        "Frontend reaches many Node routes through the Go gateway, but /api/agent is still direct in Vite dev."
      ],
      "tags": [
        "backend",
        "node",
        "xstate",
        "orchestrator"
      ]
    },
    {
      "id": "node-runtime-config",
      "kind": "config-entrypoint",
      "name": "Node runtime config",
      "path": "src/backend/server/src/config/runtime.ts",
      "languages": [
        "TypeScript"
      ],
      "stack": [
        "config",
        "dotenv",
        "commander",
        "zod"
      ],